{
  "schemaVersion": "golden-path-checker-output/v1",
  "contractVersion": "golden-path/v1",
  "standardVersion": "2026.08.3",
  "checkerVersion": "1.0.0",
  "catalogDigest": "sha256:0000000000000000000000000000000000000000000000000000000000000000",
  "evaluatedAt": "2026-07-30T00:00:00Z",
  "enforcement": "report-only",
  "profiles": [
    "node-typescript"
  ],
  "exitCode": 1,
  "complete": true,
  "summary": {
    "pass": 0,
    "fail": 1,
    "warn": 0,
    "skip": 0,
    "waived": 0,
    "error": 0
  },
  "findings": [
    {
      "ruleId": "DT-DEP-001",
      "status": "fail",
      "severity": "error",
      "assessment": "automated",
      "path": "pnpm-lock.yaml",
      "message": "Required native resolution record is missing.",
      "remediation": "Regenerate and commit the native lockfile.",
      "exceptionId": null
    }
  ]
}
